<?xml version="1.0" encoding="UTF-8"?>
<configuration xmlns:xsi="http://www.w3.org/2001/XMLSchema-instance" xsi:noNamespaceSchemaLocation="./sped-config.xsd">
  <schoolyear identifier="2020–2021">
    <students>
      <student firstName="Taylen" lastName="Beacham" dob="2008-05-20" localID="734282" gender="Male" grade="7" campus="O'Banion Middle School">
        <accommodations>
          <accommodationGroup name="Adapt Classroom Instruction">
            <accommodation name="Alternate Curriculum" subject="ELA Rdg Math SC SS"/>
            <accommodation name="Extended wait time for responses" subject="ELA Rdg Math SC PE SS FA"/>
            <accommodation name="Grades based on Grading Rubric for Participation and Socialization in a General Education Setting" subject="PE FA"/>
            <accommodation name="Grades based on Grading Rubric for Academic and Participation in a Special Education Setting" subject="ELA Rdg Math SC SS"/>
            <accommodation name="Information presented orally" subject="ELA Rdg Math SC SS"/>
            <accommodation name="Optional virtual/online instruction delivery" subject="ELA Rdg Math SC PE SS FA"/>
            <accommodation name="Pictures paired with text" subject="ELA Rdg Math SC SS"/>
            <accommodation name="Repeated verbal directions" subject="ELA Rdg Math SC PE SS FA"/>
            <accommodation name="Three (3) options for answer choices" subject="ELA Rdg Math SC SS"/>
            <accommodation name="Visual and verbal reminders to stay on task" subject="ELA Rdg Math SC PE SS FA"/>
          </accommodationGroup>
          <accommodationGroup name="Adapted or Additional Materials">
            <accommodation name="Math Manipulatives: Counters (Unifix Cubes, Dice, Beads, etc.)" subject="Math"/>
            <accommodation name="Math Manipulatives: Measuring devices (rulers, tape measure, etc.)" subject="Math"/>
            <accommodation name="Math Manipulatives: Number chart/line" subject="Math"/>
            <accommodation name="Math Manipulatives: Real or Play Money" subject="Math"/>
          </accommodationGroup>
          <accommodationGroup name="Alter Assignments or Testing">
            <accommodation name="Exemption from final/semester tests" subject="ELA Rdg Math SC PE SS FA"/>
          </accommodationGroup>
          <accommodationGroup name="Manage Behavior">
            <accommodation name="Clearly defined/consistent limits" subject="ELA Rdg Math SC PE SS FA"/>
            <accommodation name="Follow behavior intervention plan" subject="ELA Rdg Math SC PE SS FA"/>
            <accommodation name="Positive reinforcement" subject="ELA Rdg Math SC PE SS FA"/>
            <accommodation name="Preferential seating" subject="ELA Rdg Math SC PE SS FA"/>
          </accommodationGroup>
          <accommodationGroup name="Supports for School Personnel">
            <accommodation name="Support for general education teacher (provided by Special Ed. Staff)" subject="PE FA"/>
          </accommodationGroup>
        </accommodations>
        <scheduleOfServices>
          <course title="Art (Recreation/Leisure II)" gen="1 period (A or B day)" pgdb="Gen"/>
          <course title="English/Language Arts/Reading (Communications II)" spec="1 period (A or B day)" pgdb="Spec"/>
          <course title="Health ( Personal Health &amp; Hygiene II)" spec="1 period (A or B day)" pgdb="Spec"/>
          <course title="Math (Applied Consumer Skills II)" spec="1 period (A or B day)" pgdb="Spec"/>
          <course title="Physical Education (Partners in PE II)" gen="1 period (A or B day)" pgdb="Gen"/>
          <course title="Science (Applied Environmental Awareness II)" spec="1 period (A or B day)" pgdb="Spec"/>
          <course title="Social Studies (Community Citizenship II)" spec="1 period (A or B day)" pgdb="Spec"/>
          <course title="Vocation (Applied Marketable Skills II)" spec="1 period (A or B day)" pgdb="Spec"/>
        </scheduleOfServices>
        <annualGoals>
          <!--<annualGoal code="1" focus="Speech">
            <timeframe>From ARD year to ARD year</timeframe>
            <conditions>when given a visual and/or verbal direct cue(s)</conditions>
            <behavior>Taylen will communicate with others to express his knowledge and make requests</behavior>
            <criteria>with 70% accuracy</criteria>
            <objectives>
              <objective code="1.1">
                <timeframe>From ARD year to ARD year</timeframe>
                <conditions>when given a verbal an/or visual direct cue(s)</conditions>
                <behavior>Taylen will follow one-step directions to complete activities/tasks</behavior>
                <criteria>with 70% accuracy</criteria>
              </objective>
              <objective code="1.2">
                <timeframe>From ARD year to ARD year</timeframe>
                <conditions>when given a verbal an/or visual direct cue(s)</conditions>
                <behavior>Taylen will use a phrase or sentence to answer wh-questions about a story/recent event using picture cues</behavior>
                <criteria>with 70% accuracy</criteria>
              </objective>
              <objective code="1.3">
                <timeframe>From ARD year to ARD year</timeframe>
                <conditions>when given a verbal an/or visual direct cue(s)</conditions>
                <behavior>Taylen will request desired items using a phrase or sentence</behavior>
                <criteria>with 70% accuracy</criteria>
              </objective>
            </objectives>
          </annualGoal>-->
          <annualGoal code="2" focus="Health">
            <timeframe>From ARD year to ARD year</timeframe>
            <conditions>when given visual and verbal reminders to stay on task and with extended wait time for responses</conditions>
            <behavior>Taylen will recall ways to enhance and maintain personal health, and identify body structures and functions that relate to personal health</behavior>
            <criteria>70% of the time</criteria>
            <objectives>
              <objective code="2.1">
                <timeframe>From ARD year to ARD year</timeframe>
                <conditions>when given a visual representation displaying a labeled food pyramid along with several pictures of labelled food items from each food category found on the pyramid</conditions>
                <behavior>Taylen will select with his voice a balanced meal from the labelled food item pictures</behavior>
                <criteria>70% of the time</criteria>
              </objective>
              <objective code="2.2">
                <timeframe>From ARD year to ARD year</timeframe>
                <conditions>when given picture representations of the circulatory, muscular, skeletal, nervous, respiratory, and digestive body systems and a blank full human body poster</conditions>
                <behavior>Taylen will match each body system to its corresponding location on the poster</behavior>
                <criteria>70% of the time</criteria>
              </objective>
            </objectives>
          </annualGoal>
          <annualGoal code="3" focus="Physical Education">
            <timeframe>From ARD year to ARD year</timeframe>
            <conditions>when given appropriate wait time for responses and visual and verbal reminders to stay on task</conditions>
            <behavior>Taylen will safely engage to completion light-to-moderate physical activities</behavior>
            <criteria>70% of the time</criteria>
            <objectives>
              <objective code="3.1">
                <timeframe>From ARD year to ARD year</timeframe>
                <conditions>when given repeated physical demonstrations of the planned activity by the PE Coach and/or staff/peer, repeated verbal step by step descriptions of the activities using simplified language by the PE coach and/or staff/peer</conditions>
                <behavior>Taylen will participate in light-to-moderate health-related physical activities on a by properly completing the demonstrated warm up and cool down procedures for the planned activity</behavior>
                <criteria>70% of the time</criteria>
              </objective>
              <objective code="3.2">
                <timeframe>From ARD year to ARD year</timeframe>
                <conditions>when given repeated physical demonstrations of the planned activity by the PE Coach and/or staff/peer, repeated verbal step by step descriptions of the activities using simplified language by the PE coach and/or staff/peer, and frequent verbal feedback on his performance</conditions>
                <behavior>Taylen will participate in light -to-moderate health-related physical activities on a regular basis by properly completing the demonstrated planned activity</behavior>
                <criteria>70% of the time</criteria>
              </objective>
            </objectives>
          </annualGoal>
          <annualGoal code="4" focus="Fine Arts">
            <timeframe>From ARD year to ARD year</timeframe>
            <conditions>when given verbal and visual reminders to stay on task</conditions>
            <behavior>Taylen will demonstrate appreciation for Fine Arts through production of original artworks using a variety of media</behavior>
            <criteria>70% of the time</criteria>
            <objectives>
              <objective code="4.1">
                <timeframe>From ARD year to ARD year</timeframe>
                <conditions>when given a partially completed work of art to be used as a guide, a variety of materials, such as paint, paint brushes, colored pencils, markers, crayons, chalk, molding clay, stencils, and cut outs</conditions>
                <behavior>Taylen will demonstrate artistic competence by selecting the appropriate materials he must use and presenting these material choices to a teacher</behavior>
                <criteria>70% of the time</criteria>